{
  "schema_version": "hummbl_claim.v0.1",
  "registry_id": "hummbl_claims_v0.1",
  "registry_status": "candidate",
  "last_reviewed_at": "2026-07-16",
  "claim_domains": [
    {
      "code": "BKI",
      "title": "Belonging as Knowledge Infrastructure",
      "description": "Claims from BKI theory — the belonging-as-precondition thesis, four propositions, and convergence claims."
    },
    {
      "code": "BIO",
      "title": "Biocognitive OS",
      "description": "Claims about the 6 biocognitive modes and the 18-question diagnostic instrument."
    },
    {
      "code": "BRO",
      "title": "Broccolilly Heuristic",
      "description": "Claims about the S×T×C×D→R multiplicative heuristic and its failure-mode diagnostics."
    },
    {
      "code": "CON",
      "title": "Constitutional Tiers",
      "description": "Claims from the constitutional layer — Truth-Mode, Survival-Mode, Operator-Mode, Succession-Mode."
    },
    {
      "code": "OPS",
      "title": "Operational Primitives",
      "description": "Claims about Base120, Krineia, HRSI, coordination bus, kill switch, circuit breaker, and TUPLES."
    },
    {
      "code": "ARC",
      "title": "Architecture",
      "description": "Claims about how the three HUMMBL layers connect and the system's structural advantage."
    }
  ],
  "evidence_tiers": [
    {
      "code": "constitutional",
      "title": "Constitutional Invariant",
      "description": "Stated as a non-overridable constitutional constraint. Cannot be triggered or exited."
    },
    {
      "code": "theoretical",
      "title": "Theoretical Proposition",
      "description": "Stated as a theoretical claim with a cited evidence base but not independently validated by HUMMBL."
    },
    {
      "code": "heuristic",
      "title": "Heuristic",
      "description": "Stated as a conceptual framework, not a quantitative model. Predicts qualitative patterns."
    },
    {
      "code": "operational",
      "title": "Operational Protocol",
      "description": "Stated as an established operational protocol with a running implementation."
    },
    {
      "code": "unvalidated",
      "title": "Unvalidated Instrument",
      "description": "Stated as a concept instrument that has not been psychometrically or externally validated."
    },
    {
      "code": "aspirational",
      "title": "Aspirational",
      "description": "Stated as a goal or intended future state, not as a current capability."
    },
    {
      "code": "established",
      "title": "Established",
      "description": "Stated as an established fact with broad external consensus."
    },
    {
      "code": "peer_reviewed",
      "title": "Peer-Reviewed Evidence Base",
      "description": "Grounded in peer-reviewed literature cited by the source."
    }
  ],
  "claims": [
    {
      "claim_id": "BKI-CORE",
      "domain": "BKI",
      "claim_text": "Belonging is the structural precondition for knowledge creation, transmission, and transformation — not a soft social outcome.",
      "evidence_tier": "theoretical",
      "canonical_source": {
        "file_path": "PROJECTS/PSI/playground/hummbl-bki/theory/THEORY_MASTER.md",
        "status": "canonical",
        "version": "v1.0",
        "date": "2026-06-13"
      },
      "source_quote": "Belonging is the structural precondition for knowledge creation, transmission, and transformation — not a soft social outcome.",
      "claim_nature": "theory",
      "supporting_sources": [
        {
          "file_path": ".agents/rules/hummbl-primitives.md",
          "relationship": "corroborates"
        }
      ],
      "extracted_at": "2026-07-16",
      "extracted_by": "devin",
      "notes": "The core BKI thesis. Inverts the conventional model that treats knowledge as content flowing through a clear channel."
    },
    {
      "claim_id": "BKI-P1-COGNITIVE-SCAFFOLDING",
      "domain": "BKI",
      "claim_text": "Belonging is a neurobiological prerequisite for higher-order cognition: social threat activates amygdala, raises cortisol, and suppresses the prefrontal cortex, making the receiver physically incapable of the cognitive operations that knowledge transfer requires.",
      "evidence_tier": "peer_reviewed",
      "canonical_source": {
        "file_path": "PROJECTS/PSI/playground/hummbl-bki/theory/THEORY_MASTER.md",
        "status": "canonical",
        "version": "v1.0",
        "date": "2026-06-13"
      },
      "source_quote": "When an organism perceives social threat, the amygdala activates, cortisol rises, and the prefrontal cortex (the seat of abstraction, planning, and metacognition) is suppressed. In low-belonging states, the receiver is physically incapable of the cognitive operations that knowledge transfer requires.",
      "claim_nature": "theory",
      "supporting_sources": [
        {
          "file_path": ".agents/rules/hummbl-primitives.md",
          "relationship": "corroborates"
        }
      ],
      "bibliography_keys": ["ledoux1996", "ledoux2015", "arnsten1998", "sapolsky2017", "edmondson1999", "edmondson2019"],
      "extracted_at": "2026-07-16",
      "extracted_by": "devin",
      "notes": "Evidence base cited: LeDoux (1996, 2015), Arnsten (1998), Sapolsky (2017), Edmondson (1999, 2019). Bibliography keys are inferred from author+year and require Phase -1B verification against actual .bib entries."
    },
    {
      "claim_id": "BKI-P1-COMPLIANCE-THEATER",
      "domain": "BKI",
      "claim_text": "Training programs, governance rollouts, compliance education, and AI alignment work delivered into threat-state organizations produce compliance theater — the appearance of adoption without the substance.",
      "evidence_tier": "theoretical",
      "canonical_source": {
        "file_path": "PROJECTS/PSI/playground/hummbl-bki/theory/THEORY_MASTER.md",
        "status": "canonical",
        "version": "v1.0",
        "date": "2026-06-13"
      },
      "source_quote": "Training programs, governance rollouts, compliance education, and AI alignment work all fail when delivered into threat-state organizations. The content may be flawless; the receiver cannot process it. The result is 'compliance theater' — the appearance of adoption without the substance.",
      "claim_nature": "theory",
      "extracted_at": "2026-07-16",
      "extracted_by": "devin"
    },
    {
      "claim_id": "BKI-P1-HRSI-SIGNAL",
      "domain": "BKI",
      "claim_text": "HRSI baseline (Safety/Mattering/Connection) below threshold predicts compliance-theater outcomes.",
      "evidence_tier": "theoretical",
      "canonical_source": {
        "file_path": "PROJECTS/PSI/playground/hummbl-bki/theory/THEORY_MASTER.md",
        "status": "canonical",
        "version": "v1.0",
        "date": "2026-06-13"
      },
      "source_quote": "HRSI baseline (Safety/Mattering/Connection) below threshold predicts compliance-theater outcomes.",
      "claim_nature": "theory",
      "risks": [
        {
          "severity": "high",
          "description": "This is a predictive claim (HRSI predicts compliance theater) that has not been empirically tested. The HRSI instrument itself is unvalidated (see BIO-STATUS). The prediction is theoretical, not demonstrated."
        }
      ],
      "unresolved": true,
      "extracted_at": "2026-07-16",
      "extracted_by": "devin"
    },
    {
      "claim_id": "BKI-P2-RELATIONAL-VALIDATION",
      "domain": "BKI",
      "claim_text": "Knowledge claims gain epistemic authority through belonging networks, not logical validity alone; a claim's truth-status is socially constituted before it is logically constituted.",
      "evidence_tier": "peer_reviewed",
      "canonical_source": {
        "file_path": "PROJECTS/PSI/playground/hummbl-bki/theory/THEORY_MASTER.md",
        "status": "canonical",
        "version": "v1.0",
        "date": "2026-06-13"
      },
      "source_quote": "Knowledge claims gain epistemic authority through belonging networks, not logical validity alone. A claim's truth-status is socially constituted before it is logically constituted. This is not relativism — the underlying empirical referent is real — but it is realism about how knowledge actually circulates.",
      "claim_nature": "theory",
      "bibliography_keys": ["baumeister1995", "kahn1990", "mayer1995"],
      "extracted_at": "2026-07-16",
      "extracted_by": "devin",
      "notes": "Evidence base cited: Baumeister & Leary (1995), Kahn (1990), Mayer, Davis & Schoorman (1995). Bibliography keys inferred from author+year."
    },
    {
      "claim_id": "BKI-P2-TRUST-ASYMMETRY",
      "domain": "BKI",
      "claim_text": "A correct claim from a low-trust source will be rejected; a flawed claim from a high-trust source will be accepted.",
      "evidence_tier": "theoretical",
      "canonical_source": {
        "file_path": "PROJECTS/PSI/playground/hummbl-bki/theory/THEORY_MASTER.md",
        "status": "canonical",
        "version": "v1.0",
        "date": "2026-06-13"
      },
      "source_quote": "A correct claim from a low-trust source will be rejected; a flawed claim from a high-trust source will be accepted.",
      "claim_nature": "theory",
      "risks": [
        {
          "severity": "medium",
          "description": "Stated as an absolute ('will be rejected' / 'will be accepted') rather than a probabilistic tendency. The source does not cite empirical evidence for this specific asymmetry; it is an inference from the relational validation proposition."
        }
      ],
      "unresolved": true,
      "extracted_at": "2026-07-16",
      "extracted_by": "devin"
    },
    {
      "claim_id": "BKI-P3-EMBODIED-KNOWING",
      "domain": "BKI",
      "claim_text": "Wisdom transmits somatically; instructional delivery reaches propositional content only. Apprenticeship, lived practice, and direct co-presence transmit competencies that curriculum cannot.",
      "evidence_tier": "peer_reviewed",
      "canonical_source": {